VARNAME,VARDESC,DOCFILE,TYPE,UNITS,MIN,MAX,RESOLUTION,COMMENT1,COMMENT2,VARIABLE_SOURCE,SOURCE_VARIABLE_ID,VARIABLE_MAPPING,UNIQUEKEY,COLLINTERVAL,ORDER,VALUES,,,,,,,,,,,,,,,,,,,,,,,,,,,,,,,,,,,,,,,,,,,,,,,,,,,,,,,,,,,,,,
PX080401_Mouth_Dry_Frequently,Does your mouth frequently feel dry?,DCW_080401.doc,encoded values,,,,,,,PhenX,PX080401010000,,,,,0 = No,1 = Yes,,,,,,,,,,,,,,,,,,,,,,,,,,,,,,,,,,,,,,,,,,,,,,,,,,,,,,,,,,,,,
PX080401_Mouth_Dry_When_Eating,Does your mouth feel dry when eating?,DCW_080401.doc,encoded values,,,,,,,PhenX,PX080401020000,,,,,0 = No,1 = Yes,,,,,,,,,,,,,,,,,,,,,,,,,,,,,,,,,,,,,,,,,,,,,,,,,,,,,,,,,,,,,
PX080401_Mouth_Saliva_Amount,Does the amount of saliva in your mouth seem to be:,DCW_080401.doc,encoded values,,,,,,,PhenX,PX080401030000,,,,,0 = Too little,1 = Too much,2 = Don't notice it,,,,,,,,,,,,,,,,,,,,,,,,,,,,,,,,,,,,,,,,,,,,,,,,,,,,,,,,,,,,
PX080401_Sip_Liquids_Keep_Mouth_Moist,Do you sip liquids frequently during the day to keep your mouth moist?,DCW_080401.doc,encoded values,,,,,,,PhenX,PX080401040000,,,,,0 = No,1 = Yes,2 = Not sure,,,,,,,,,,,,,,,,,,,,,,,,,,,,,,,,,,,,,,,,,,,,,,,,,,,,,,,,,,,,
PX080401_Difficulty_Swallow_Without_Addition_Fluids,Do you have difficulties swallowing food if you eat without additional fluids?,DCW_080401.doc,encoded values,,,,,,,PhenX,PX080401050000,,,,,0 = No,1 = Yes,2 = Not sure,,,,,,,,,,,,,,,,,,,,,,,,,,,,,,,,,,,,,,,,,,,,,,,,,,,,,,,,,,,,
