VARNAME,VARDESC,DOCFILE,TYPE,UNITS,MIN,MAX,RESOLUTION,COMMENT1,COMMENT2,VARIABLE_SOURCE,SOURCE_VARIABLE_ID,VARIABLE_MAPPING,UNIQUEKEY,COLLINTERVAL,ORDER,VALUES,,,,,,,,,,,,,,,,,,,,,,,,,,,,,,,,,,,,,,,,,,,,,,,,,,,,,,,,,,,,,,
PX051401_Sodium_Container,Was the specimen collection container prescreened for traces of sodium contamination?,DCW_51401.doc,enumerated,,,,,,,PhenX,PX051401010000,,,,,Yes,No,,,,,,,,,,,,,,,,,,,,,,,,,,,,,,,,,,,,,,,,,,,,,,,,,,,,,,,,,,,,,
PX051401_Sodium_UrineSpecimen_QualityControl,Did the patient take a PABA pill at least three days prior to urine collection?,DCW_51401.doc,enumerated,,,,,,,PhenX,PX051401020000,,,,,Yes,No,,,,,,,,,,,,,,,,,,,,,,,,,,,,,,,,,,,,,,,,,,,,,,,,,,,,,,,,,,,,,
PX051401_Sodium_UrineSpecimen_Storage,What is the sodium and potassium content in the urine as determined through Ion Selective Electrode?,DCW_51401.doc,enumerated,,,,,,,PhenX,PX051401030000,,,,,Yes,No,,,,,,,,,,,,,,,,,,,,,,,,,,,,,,,,,,,,,,,,,,,,,,,,,,,,,,,,,,,,,
PX051401_Sodium_UrineSpecimen_Age,What is the creatinine content as determined through the Creatinine (urinary) Jaffe kinetic method?,DCW_51401.doc,enumerated,,,,,,,PhenX,PX051401040000,,,,,Yes,No,,,,,,,,,,,,,,,,,,,,,,,,,,,,,,,,,,,,,,,,,,,,,,,,,,,,,,,,,,,,,
PX051401_Sodium_Urinary_Sodium_Concentration,Urinary sodium Concentration from bioassay,DCW_51401.doc,decimal,nanograms per milliliter,,,,,,PhenX,PX051401050000,,,,,,,,,,,,,,,,,,,,,,,,,,,,,,,,,,,,,,,,,,,,,,,,,,,,,,,,,,,,,,,,,,,
