VARNAME,VARDESC,DOCFILE,TYPE,UNITS,MIN,MAX,RESOLUTION,COMMENT1,COMMENT2,VARIABLE_SOURCE,SOURCE_VARIABLE_ID,VARIABLE_MAPPING,UNIQUEKEY,COLLINTERVAL,ORDER,VALUES,,,,,,,,,,,,,,,,
PX100702_Hormonal_Therapy_Prescription_Female_Hormones,Have you used prescription female hormones? (Not including contraceptives.),DCW_100702.doc,enumerated,,,,,,,PhenX,PX100702010100,,,,,Yes,No (skip to 1d),,,,,,,,,,,,,,,
PX100702_Hormonal_Therapy_Prescription_Female_Hormones_Length_Use,How many months did you use hormones?,DCW_100702.doc,enumerated,,,,,,,PhenX,PX100702010200,,,,,1 - 4 months,5 - 9 months,10 - 14 months,15 - 19 months,20 - 25 months,26 - 30 months,31 - 35 months,36+ months,,,,,,,,,
PX100702_Hormonal_Therapy_Prescription_Female_Hormones_Currently_Using,Are you currently using them (within the last month)?,DCW_100702.doc,enumerated,,,,,,,PhenX,PX100702010300,,,,,Yes,No,,,,,,,,,,,,,,,
PX100702_Hormonal_Therapy_Prescription_Female_Hormones_Currently_Using_Type,Mark the type(s) of hormones you are CURRENTLY using:,DCW_100702.doc,enumerated,,,,,,,PhenX,PX100702010401,,,,,Prempro,Premphase,Combipatch,FemHRT,Estrogen,Oral Premarin or Conjugated estrogen,Patch Estrogen,Vaginal Estrogen,Estrace,"Estrogen gels, creams, or sprays on skin",Estratest,Other Estrogen Specify:____________,Progesterone/Progestin:,Provera/Cycrin/MPA,Vaginal,"Micronized (e.g., Prometrium)",Other progesterone (specify type):___________
PX100702_Hormonal_Therapy_Prescription_Female_Hormones_Currently_Using_Type_Other,Mark the type(s) of hormones you are CURRENTLY using:,DCW_100702.doc,string,,,,,,,PhenX,PX100702010402,,,,,,,,,,,,,,,,,,,,,
PX100702_Hormonal_Therapy_Prescription_Female_Hormones_Oral_Conjugated_Dose,"If you used oral conjugated estrogen (e.g., Premarin), what dose did you usually take?",DCW_100702.doc,enumerated,,,,,,,PhenX,PX100702010500,,,,,.30 mg/day or less,.45 mg/day,.625 mg/day,.9 mg/day,1.25 mg/day or higher,Unsure,Did not take oral conjugated estrogen,No (skip to 2),,,,,,,,,
PX100702_Hormonal_Therapy_Over_The_Counter_OTC,Are you currently using any of these over-the-counter (OTC) preparations for hormone replacement?,DCW_100702.doc,enumerated,,,,,,,PhenX,PX100702020000,,,,,Soy estrogen products,"Black cohosh (e.g., Remifemin)",Natural progesterone cream/wild yam,Other OTC,,,,,,,,,,,,,
