VARNAME,VARDESC,DOCFILE,TYPE,UNITS,MIN,MAX,RESOLUTION,COMMENT1,COMMENT2,VARIABLE_SOURCE,SOURCE_VARIABLE_ID,VARIABLE_MAPPING,UNIQUEKEY,COLLINTERVAL,ORDER,VALUES,
PX251201_Life_Space_Past_Three_Days_Other_Rooms,"During the past 3 days, have you been to other rooms of your home besides the room where you sleep?",DCW_251201.doc,encoded values,,,,,,,PhenX,PX251201010000,,,,,1 = Yes,2 = No
PX251201_Life_Space_Past_Three_Days_Immediate_Outside_Home,"During the past 3 days, have you been to an area immediately outside your home such as your porch, deck or patio, hallway of an apartment building, garage?",DCW_251201.doc,encoded values,,,,,,,PhenX,PX251201020000,,,,,1 = Yes,2 = No
PX251201_Life_Space_Past_Three_Days_Outside_Home,"During the past 3 days, have you been to an area outside your home such as a yard, courtyard, driveway, or parking lot?",DCW_251201.doc,encoded values,,,,,,,PhenX,PX251201030000,,,,,1 = Yes,2 = No
PX251201_Life_Space_Past_Three_Days_Neighborhood_Property,"During the past 3 days, have you been to places in your immediate neighborhood, but beyond your own property or apartment building?",DCW_251201.doc,encoded values,,,,,,,PhenX,PX251201040000,,,,,1 = Yes,2 = No
PX251201_Life_Space_Past_Three_Days_Neighborhood_Town,"During the past 3 days, have you been to places outside your immediate neighborhood but within your town or community?",DCW_251201.doc,encoded values,,,,,,,PhenX,PX251201050000,,,,,1 = Yes,2 = No
PX251201_Life_Space_Past_Three_Days_Town,"During the past 3 days, have you been to places outside your immediate town or community?",DCW_251201.doc,encoded values,,,,,,,PhenX,PX251201060000,,,,,1 = Yes,2 = No
PX251201_Life_Space_Past_Three_Days_County,"During the past 3 days, have you been to places outside of your county?",DCW_251201.doc,encoded values,,,,,,,PhenX,PX251201070000,,,,,1 = Yes,2 = No
PX251201_Life_Space_Past_Three_Days_State,"During the past 3 days, have you been to places outside the state of INSERT STATE NAME?",DCW_251201.doc,encoded values,,,,,,,PhenX,PX251201080000,,,,,1 = Yes,2 = No
PX251201_Life_Space_Past_Three_Days_Region,"During the past 3 days, have you been to places outside the INSERT REGION region?",DCW_251201.doc,encoded values,,,,,,,PhenX,PX251201090000,,,,,1 = Yes,2 = No
