VARNAME,VARDESC,DOCFILE,TYPE,UNITS,MIN,MAX,RESOLUTION,COMMENT1,COMMENT2,VARIABLE_SOURCE,SOURCE_VARIABLE_ID,VARIABLE_MAPPING,UNIQUEKEY,COLLINTERVAL,ORDER,VALUES,,,,,,,,,,
PX291101_Water_Access_Sanitation_Residence_Type,"Is [answer from Current Address] a house, an apartment, a manufactured/mobile home, or some other type of residence?",DCW_291101.doc,encoded values,,,,,,,PhenX,PX291101010100,,,,,1 = House,"2 = Apartment, flat",3 = Manufactured/mobile home,"5 = HU in nontransient hotel, motel, etc","6 = HU, permanent in transient hotel, motel",7 = HU in rooming house or boarding house,8 = Boat or recreational vehicle,"9 = Tent, cave, or railroad car","10 = HU not specified above, specify","11 = Unoccupied site for manufactured/mobile home, trailer, or tent",12 = Group Quarters
PX291101_Water_Access_Sanitation_Residence_Type_Other,Specify other type of home,DCW_291101.doc,string,,,,,"ASK IF ""Is [answer from Current Address] a house an apartment a manufactured/mobile home or some other type of residence? "" = ""HU not specified above specify""",,PhenX,PX291101010200,,,,,,,,,,,,,,,
PX291101_Water_Access_Sanitation_Residence_Toilet,Does your your/the/that [Question 1 answer] have a toilet?,DCW_291101.doc,encoded values,,,,,,,PhenX,PX291101020000,,,,,1 = Yes,2 =  No,,,,,,,,,
PX291101_Water_Access_Sanitation_Residence_Bathtub_Shower,Does your/the/that [Question 1 answer] have a bathtub or shower?,DCW_291101.doc,encoded values,,,,,,,PhenX,PX291101030000,,,,,1 = Yes,2 = No,,,,,,,,,
PX291101_Water_Access_Sanitation_Residence_Sewage_Disposal_Type,What means of sewage disposal does your/the/that [Question 1 answer] have?,DCW_291101.doc,encoded values,,,,,,,PhenX,PX291101040100,,,,,1 = Septic tank,2 = Cesspool,3 = Chemical toilet,4 = Outhouse or privy,5 = Other; specify,6 = None,,,,,
PX291101_Water_Access_Sanitation_Residence_Sewage_Disposal_Type_Other,Specify other type of sewage disposal,DCW_291101.doc,string,,,,,"ASK IF ""What means of sewage disposal does your/the/that [Question 1 answer] have?"" = ""Other; specify""",,PhenX,PX291101040200,,,,,,,,,,,,,,,
PX291101_Water_Access_Sanitation_Residence_Hot_Cold_Anywhere,Is there both hot and cold water anywhere in your/the/that home?,DCW_291101.doc,encoded values,,,,,,,PhenX,PX291101050000,,,,,1 = Yes,2 = No,,,,,,,,,
