VARNAME,VARDESC,DOCFILE,TYPE,UNITS,MIN,MAX,RESOLUTION,COMMENT1,COMMENT2,VARIABLE_SOURCE,SOURCE_VARIABLE_ID,VARIABLE_MAPPING,UNIQUEKEY,COLLINTERVAL,ORDER,VALUES,,,,,,,,,,,,,,,,,,,,,,,,,,,,,,,,,,,,,,,,,,,,,,,,,,,,,,,,,,,,,,
PX570201_Tested_For_HIV,Have you ever been tested for HIV?,DCW_570201.doc,encoded values,,,,,,,PhenX,PX570201010000,,,,,0 = No,1 = Yes,7 = Refused to answer,9 = Don’t know,,,,,,,,,,,,,,,,,,,,,,,,,,,,,,,,,,,,,,,,,,,,,,,,,,,,,,,,,,,
PX570201_Most_Recent_HIV_Test_Month,When did you have your most recent HIV test? Month,DCW_570201.doc,integer,,,,,,,PhenX,PX570201020100,,,,,77 = Refused,99 = Don’t know,,,,,,,,,,,,,,,,,,,,,,,,,,,,,,,,,,,,,,,,,,,,,,,,,,,,,,,,,,,,,
PX570201_Most_Recent_HIV_Test_Year,When did you have your most recent HIV test? Year,DCW_570201.doc,integer,,,,,,,PhenX,PX570201020200,,,,,7777 = Refused,9999 = Don’t know,,,,,,,,,,,,,,,,,,,,,,,,,,,,,,,,,,,,,,,,,,,,,,,,,,,,,,,,,,,,,
PX570201_Most_Recent_HIV_Test_Result,What was the result of your most recent HIV test?,DCW_570201.doc,encoded values,,,,,,,PhenX,PX570201030000,,,,,1 = Negative,2 = Positive,3 = Never obtained results,4 = Indeterminate,7 = Refused to answer,9 = Don’t know,,,,,,,,,,,,,,,,,,,,,,,,,,,,,,,,,,,,,,,,,,,,,,,,,,,,,,,,,
PX570201_Reason_Not_Tested_For_HIV,I’m going to read you a list of reasons why some people have not been tested for HIV. Which of these best describes the most important reason you have not been tested for HIV in the past 12 months?,DCW_570201.doc,encoded values,,,,,,,PhenX,PX570201040000,,,,,1 = You think you are at low risk for HIV infection?,2 = You were afraid of finding out that you had HIV?,3 = You didn’t have time?,4 = Some other reason?,5 = No particular reason,7 = Refused to answer,9 = Don’t know,,,,,,,,,,,,,,,,,,,,,,,,,,,,,,,,,,,,,,,,,,,,,,,,,,,,,,,,
