VARNAME,VARDESC,DOCFILE,TYPE,UNITS,MIN,MAX,RESOLUTION,COMMENT1,COMMENT2,VARIABLE_SOURCE,SOURCE_VARIABLE_ID,VARIABLE_MAPPING,UNIQUEKEY,COLLINTERVAL,ORDER,VALUES,,,,,,,,,,,,,,,,,,,,,,,,,,,,,,,,,,,,,,,,,,,,,,,,,,,,,,,,,,,,,,
PX640801_Insomnia_Falling_Asleep,Please rate the CURRENT (i.e. LAST 2 WEEKS) SEVERITY of your insomnia problem(s).Difficulty falling asleep,DCW_640801.doc,encoded values,,,,,,,PhenX,PX640801010100,,,,,None = 0,Mild = 1,Moderate = 2,Severe = 3,Very Severe = 4,,,,,,,,,,,,,,,,,,,,,,,,,,,,,,,,,,,,,,,,,,,,,,,,,,,,,,,,,,
PX640801_Insomnia_Staying_Asleep,Please rate the CURRENT (i.e. LAST 2 WEEKS) SEVERITY of your insomnia problem(s).Difficulty staying asleep,DCW_640801.doc,encoded values,,,,,,,PhenX,PX640801010200,,,,,None = 0,Mild = 1,Moderate = 2,Severe = 3,Very Severe = 4,,,,,,,,,,,,,,,,,,,,,,,,,,,,,,,,,,,,,,,,,,,,,,,,,,,,,,,,,,
PX640801_Insomnia_Waking_Up_Early,Please rate the CURRENT (i.e. LAST 2 WEEKS) SEVERITY of your insomnia problem(s).Problems waking up too early,DCW_640801.doc,encoded values,,,,,,,PhenX,PX640801010300,,,,,None = 0,Mild = 1,Moderate = 2,Severe = 3,Very Severe = 4,,,,,,,,,,,,,,,,,,,,,,,,,,,,,,,,,,,,,,,,,,,,,,,,,,,,,,,,,,
PX640801_Insomnia_SatisfiedDissatisfied_Sleep_Pattern,How SATISFIED/DISSATISFIED are you with your CURRENT sleep pattern?,DCW_640801.doc,encoded values,,,,,,,PhenX,PX640801010400,,,,,0 = Very Satisfied,1 = Satisfied,2 = Moderately Satisfied,3 = Dissatisfied,4 = Very Dissatisfied,,,,,,,,,,,,,,,,,,,,,,,,,,,,,,,,,,,,,,,,,,,,,,,,,,,,,,,,,,
PX640801_Insomnia_Noticeable_Impairing_QOL,How NOTICEABLE to others do you think your sleep problem is in terms of impairing the quality of your life?,DCW_640801.doc,encoded values,,,,,,,PhenX,PX640801010500,,,,,0 = Not at all Noticeable,1 = A Little,2 = Somewhat,3 = Much,4 = Very Much Noticeable,,,,,,,,,,,,,,,,,,,,,,,,,,,,,,,,,,,,,,,,,,,,,,,,,,,,,,,,,,
PX640801_Insomnia_Worried_Distressed,How WORRIED/DISTRESSED are you about your current sleep problem?,DCW_640801.doc,encoded values,,,,,,,PhenX,PX640801010600,,,,,0 = Not at all Worried,1 = A Little,2 = Somewhat,3 = Much,4 = Very Much Worried,,,,,,,,,,,,,,,,,,,,,,,,,,,,,,,,,,,,,,,,,,,,,,,,,,,,,,,,,,
PX640801_Insomnia_Interfere_DailyFunctioning,"To what extent do you consider your sleep problem to INTERFERE with your daily functioning (e.g. daytime fatigue, mood, ability to function at work/daily chores, concentration, memory, mood, etc.) CURRENTLY?",DCW_640801.doc,encoded values,,,,,,,PhenX,PX640801010700,,,,,0 = Not at all Interfering,1 = A little,2 = Somewhat,3 = Much,4 = Very Much Interfering,,,,,,,,,,,,,,,,,,,,,,,,,,,,,,,,,,,,,,,,,,,,,,,,,,,,,,,,,,
PX640801_Insomnia_Scoring,Add the scores for all seven items (questions 1 + 2 + 3 + 4 + 5 +6 + 7) = ____ your total score    Total score categories:  0–7 = No clinically significant insomnia  8–14 = Sub-threshold insomnia  15–21 = Clinical insomnia (moderate severity)  22–28 = Clinical insomnia (severe),DCW_640801.doc,integer,,,,,,,PhenX,PX640801010800,,,,,0…28,,,,,,,,,,,,,,,,,,,,,,,,,,,,,,,,,,,,,,,,,,,,,,,,,,,,,,,,,,,,,,
