"VARNAME","VARDESC","DOCFILE","TYPE","UNITS","MIN","MAX","RESOLUTION","COMMENT1","COMMENT2","VARIABLE_SOURCE","SOURCE_VARIABLE_ID","VARIABLE_MAPPING","UNIQUEKEY","COLLINTERVAL","ORDER","VALUES"
"PX880501_Fertility_Quality_Of_Life_Rate_Health","How would you rate your health?","DCW_880501.doc","enumerated","","","","","","","PhenX","PX880501010000","","","","","Very Poor","Poor","Neither Good nor Poor","Good","Very Good","",""
"PX880501_Fertility_Quality_Of_Life_Satisfied","Are you satisfied with your quality of life?","DCW_880501.doc","enumerated","","","","","","","PhenX","PX880501020000","","","","","Very Dissatisfied","Dissatisfied","Neither Satisfied Nor Dissatisfied","Satisfied","Very Satisfied","",""
"PX880501_Fertility_Quality_Of_Life_Attention_Concentration_Impaired_By_Thoughts","Are your attention and concentration impaired by thoughts of infertility?","DCW_880501.doc","enumerated","","","","","","","PhenX","PX880501030000","","","","","Completely","A Great Deal","Moderately","Not Much","Not At All","",""
"PX880501_Fertility_Quality_Of_Life_Cannot_Move_Ahead_Other_Life_Goals","Do you think you cannot move ahead with other life goals and plans because of fertility problems?","DCW_880501.doc","enumerated","","","","","","","PhenX","PX880501040000","","","","","Completely","A Great Deal","Moderately","Not Much","Not At All","",""
"PX880501_Fertility_Quality_Of_Life_Feel_Drained_Worn_Out","Do you feel drained or worn out because of fertility problems?","DCW_880501.doc","enumerated","","","","","","","PhenX","PX880501050000","","","","","Completely","A Great Deal","Moderately","Not Much","Not At All","",""
"PX880501_Fertility_Quality_Of_Life_Feel_Able_Cope","Do you feel able to cope with your fertility problems?","DCW_880501.doc","enumerated","","","","","","","PhenX","PX880501060000","","","","","Completely","A Great Deal","Moderately","Not Much","Not At All","",""
"PX880501_Fertility_Quality_Of_Life_Satisfied_Support_Receive_From_Friends","Are you satisfied with the support you receive from friends with regard to your fertility problems?","DCW_880501.doc","enumerated","","","","","","","PhenX","PX880501070000","","","","","Very Dissatisfied","Dissatisfied","Neither Satisfied Nor Dissatisfied","Satisfied","Very Satisfied","",""
"PX880501_Fertility_Quality_Of_Life_Satisfied_Sexual_Relationship","Are you satisfied with your sexual relationship even though you have fertility problems?","DCW_880501.doc","enumerated","","","","","","","PhenX","PX880501080000","","","","","Very Dissatisfied","Dissatisfied","Neither Satisfied Nor Dissatisfied","Satisfied","Very Satisfied","",""
"PX880501_Fertility_Quality_Of_Life_Problems_Cause_Jealousy_Resentment","Do your fertility problems cause feelings of jealousy and resentment?","DCW_880501.doc","enumerated","","","","","","","PhenX","PX880501090000","","","","","Always","Very Often","Quite Often","Seldom","Never","",""
"PX880501_Fertility_Quality_Of_Life_Experience_Grief_Feelings_Loss_Not_Able_Have_Child","Do you experience grief and/or feelings of loss about not being able to have a child (or more children)?","DCW_880501.doc","enumerated","","","","","","","PhenX","PX880501100000","","","","","Always","Very Often","Quite Often","Seldom","Never","",""
"PX880501_Fertility_Quality_Of_Life_Fluctuate_Between_Hope_Despair","Do you fluctuate between hope and despair because of fertility problems?","DCW_880501.doc","enumerated","","","","","","","PhenX","PX880501110000","","","","","Always","Very Often","Quite Often","Seldom","Never","",""
"PX880501_Fertility_Quality_Of_Life_Socially_Isolated","Are you socially isolated because of fertility problems?","DCW_880501.doc","enumerated","","","","","","","PhenX","PX880501120000","","","","","Always","Very Often","Quite Often","Seldom","Never","",""
"PX880501_Fertility_Quality_Of_Life_Partner_Affectionate_With_Each_Other","Are you and your partner affectionate with each other even though you have fertility problems?","DCW_880501.doc","enumerated","","","","","","","PhenX","PX880501130000","","","","","Always","Very Often","Quite Often","Seldom","Never","",""
"PX880501_Fertility_Quality_Of_Life_Interfere_Day_Work_Obligations","Do your fertility problems interfere with your day-to-day work or obligations?","DCW_880501.doc","enumerated","","","","","","","PhenX","PX880501140000","","","","","Always","Very Often","Quite Often","Seldom","Never","",""
"PX880501_Fertility_Quality_Of_Life_Feel_Uncomfortable_Attending_Social_Situations","Do you feel uncomfortable attending social situations like holidays and celebrations because of your fertility problems?","DCW_880501.doc","enumerated","","","","","","","PhenX","PX880501150000","","","","","Always","Very Often","Quite Often","Seldom","Never","",""
"PX880501_Fertility_Quality_Of_Life_Feel_Family_Understand","Do you feel your family can understand what you are going through?","DCW_880501.doc","enumerated","","","","","","","PhenX","PX880501160000","","","","","Always","Very Often","Quite Often","Seldom","Never","",""
"PX880501_Fertility_Quality_Of_Life_Strengthened_Commitment_To_Partner","Have fertility problems strengthened your commitment to your partner?","DCW_880501.doc","enumerated","","","","","","","PhenX","PX880501170000","","","","","An Extreme Amount","Very Much","A Moderate Amount","A Little","Not At All","",""
"PX880501_Fertility_Quality_Of_Life_Feel_Sad_Depressed","Do you feel sad and depressed about your fertility problems?","DCW_880501.doc","enumerated","","","","","","","PhenX","PX880501180000","","","","","An Extreme Amount","Very Much","A Moderate Amount","A Little","Not At All","",""
"PX880501_Fertility_Quality_Of_Life_Inferior_To_People_With_Children","Do your fertility problems make you inferior to people with children?","DCW_880501.doc","enumerated","","","","","","","PhenX","PX880501190000","","","","","An Extreme Amount","Very Much","A Moderate Amount","A Little","Not At All","",""
"PX880501_Fertility_Quality_Of_Life_Bothered_Fatigue","Are you bothered by fatigue because of fertility problems?","DCW_880501.doc","enumerated","","","","","","","PhenX","PX880501200000","","","","","An Extreme Amount","Very Much","A Moderate Amount","A Little","Not At All","",""
"PX880501_Fertility_Quality_Of_Life_Negative_Impact_Relationship_Partner","Have fertility problems had a negative impact on your relationship with your partner?","DCW_880501.doc","enumerated","","","","","","","PhenX","PX880501210000","","","","","An Extreme Amount","Very Much","A Moderate Amount","A Little","Not At All","",""
"PX880501_Fertility_Quality_Of_Life_Difficult_Talk_Partner_Feelings","Do you find it difficult to talk to your partner about your feelings related to infertility?","DCW_880501.doc","enumerated","","","","","","","PhenX","PX880501220000","","","","","An Extreme Amount","Very Much","A Moderate Amount","A Little","Not At All","",""
"PX880501_Fertility_Quality_Of_Life_Content_Relationship","Are you content with your relationship even though you have fertility problems?","DCW_880501.doc","enumerated","","","","","","","PhenX","PX880501230000","","","","","An Extreme Amount","Very Much","A Moderate Amount","A Little","Not At All","",""
"PX880501_Fertility_Quality_Of_Life_Feel_Social_Pressure_Have_Children","Do you feel social pressure on you to have (or have more) children?","DCW_880501.doc","enumerated","","","","","","","PhenX","PX880501240000","","","","","An Extreme Amount","Very Much","A Moderate Amount","A Little","Not At All","",""
"PX880501_Fertility_Quality_Of_Life_Angry","Do your fertility problems make you angry?","DCW_880501.doc","enumerated","","","","","","","PhenX","PX880501250000","","","","","An Extreme Amount","Very Much","A Moderate Amount","A Little","Not At All","",""
"PX880501_Fertility_Quality_Of_Life_Feel_Pain_Physical_Discomfort","Do you feel pain and physical discomfort because of your fertility problems?","DCW_880501.doc","enumerated","","","","","","","PhenX","PX880501260000","","","","","An Extreme Amount","Very Much","A Moderate Amount","A Little","Not At All","",""
"PX880501_Fertility_Quality_Of_Life_Treatment_Negatively_Affect_Mood","Does infertility treatment negatively affect your mood?","DCW_880501.doc","enumerated","","","","","","","PhenX","PX880501270000","","","","","Always","Very Often","Quite Often","Seldom","Never","",""
"PX880501_Fertility_Quality_Of_Life_Medical_Services_Available","Are the fertility medical services you would like available to you?","DCW_880501.doc","enumerated","","","","","","","PhenX","PX880501280000","","","","","Always","Very Often","Quite Often","Seldom","Never","",""
"PX880501_Fertility_Quality_Of_Life_Complicated_Dealing_With_Procedure_Administration_Medication_Treatment","How complicated is dealing with the procedure and/ or administration of medication for your infertility treatment(s)?","DCW_880501.doc","enumerated","","","","","","","PhenX","PX880501290000","","","","","An Extreme Amount","Very Much","A Moderate Amount","A Little","Not At All","",""
"PX880501_Fertility_Quality_Of_Life_Bothered_Effect_Treatment_Daily_Work_Activities","Are you bothered by the effect of treatment on your daily or work related activities?","DCW_880501.doc","enumerated","","","","","","","PhenX","PX880501300000","","","","","An Extreme Amount","Very Much","A Moderate Amount","A Little","Not At All","",""
"PX880501_Fertility_Quality_Of_Life_Feel_Staff_Understand","Do you feel the fertility staff understand what you are going through?","DCW_880501.doc","enumerated","","","","","","","PhenX","PX880501310000","","","","","An Extreme Amount","Very Much","A Moderate Amount","A Little","Not At All","",""
"PX880501_Fertility_Quality_Of_Life_Bothered_Physical_Side_Effects_Medication_Treatment","Are you bothered by the physical side effects of fertility medications and treatment?","DCW_880501.doc","enumerated","","","","","","","PhenX","PX880501320000","","","","","An Extreme Amount","Very Much","A Moderate Amount","A Little","Not At All","",""
"PX880501_Fertility_Quality_Of_Life_Satisfied_Services_Available_Address_Emotional_Needs","Are you satisfied with the quality of services available to you to address your emotional needs?","DCW_880501.doc","enumerated","","","","","","","PhenX","PX880501330000","","","","","Very Dissatisfied","Dissatisfied","Neither Satisfied Nor Dissatisfied","Satisfied","Very Satisfied","",""
"PX880501_Fertility_Quality_Of_Life_Rate_Surgery_Medical_Treatment","How would you rate the surgery and/or medical treatment(s) you have received?","DCW_880501.doc","enumerated","","","","","","","PhenX","PX880501340000","","","","","Very Dissatisfied","Dissatisfied","Neither Satisfied Nor Dissatisfied","Satisfied","Very Satisfied","",""
"PX880501_Fertility_Quality_Of_Life_Rate_Information_Received_About_Medication_Surgery_Treatment","How would you rate the quality of information you received about medication, surgery and/or medical treatment?","DCW_880501.doc","enumerated","","","","","","","PhenX","PX880501350000","","","","","Very Dissatisfied","Dissatisfied","Neither Satisfied Nor Dissatisfied","Satisfied","Very Satisfied","",""
"PX880501_Fertility_Quality_Of_Life_Satisfied_Interactions_Medical_Staff","Are you satisfied with your interactions with fertility medical staff?","DCW_880501.doc","enumerated","","","","","","","PhenX","PX880501360000","","","","","Very Dissatisfied","Dissatisfied","Neither Satisfied Nor Dissatisfied","Satisfied","Very Satisfied","",""
