VARNAME,VARDESC,DOCFILE,TYPE,UNITS,MIN,MAX,RESOLUTION,COMMENT1,COMMENT2,VARIABLE_SOURCE,SOURCE_VARIABLE_ID,VARIABLE_MAPPING,UNIQUEKEY,COLLINTERVAL,ORDER,VALUES,,
PX860403_Pain_Intensity_Toddler_Face,Face,DCW_860403.doc,encoded values,,,,,,,PhenX,PX860403010000,,,,,0 = No particular expression or smile.,1 = Occasional grimace or frown; withdrawn or disinterested; appears sad or worried.,"2 = Consistent grimace or frown; frequent/constant quivering chin, clenched jaw; distressed-looking face; expression of fright or panic."
PX860403_Pain_Intensity_Toddler_Legs,Legs,DCW_860403.doc,encoded values,,,,,,,PhenX,PX860403020000,,,,,0 = Normal position or relaxed; usual tone and motion to limbs,"1 = Uneasy, restless, tense; occasional tremors.","2 = Kicking, or legs drawn up; marked increase in spasticity, constant tremors or jerking."
PX860403_Pain_Intensity_Toddler_Activity,Activity,DCW_860403.doc,encoded values,,,,,,,PhenX,PX860403030000,,,,,"0 = Lying quietly, normal position, moves easily; regular, rhythmic respirations.","1 = Squirming, shifting back and forth, tense or guarded movements; mildly agitated (e.g., head back and forth, aggression); shallow, splinting respirations, intermittent sighs","2 = Arched, rigid or jerking; severe agitation; head banging; shivering (not rigors); breath holding, gasping, or sharp intake of breaths, severe splinting."
PX860403_Pain_Intensity_Toddler_Cry,Cry,DCW_860403.doc,encoded values,,,,,,,PhenX,PX860403040000,,,,,0 = No cry/verbalization,1 = Moans or whimpers; occasional complaint; occasional verbal outburst or grunt,"2 = Crying steadily, screams or sobs, frequent complaints; repeated outbursts, constant grunting."
PX860403_Pain_Intensity_Toddler_Consolability,Consolability,DCW_860403.doc,encoded values,,,,,,,PhenX,PX860403050000,,,,,0 = Content and relaxed,"1 = Reassured by occasional touching, hugging, or being talked to. Distractible","2 = Difficult to console or comfort; pushing away caregiver, resisting care or comfort measures."
