VARNAME,VARDESC,DOCFILE,TYPE,UNITS,MIN,MAX,RESOLUTION,COMMENT1,COMMENT2,VARIABLE_SOURCE,SOURCE_VARIABLE_ID,VARIABLE_MAPPING,UNIQUEKEY,COLLINTERVAL,ORDER,VALUES,
PX911002_Factor_Nine_Population_Clotting_Extended_Sample_Collection,Were the sample collection procedures outlined in Lippi et al. (2012) followed?,DCW_911002.doc,enumerated,,,,,,,PhenX,PX911002010100,,,,,Yes,No
PX911002_Factor_Nine_Population_Clotting_Extended_Sample_Collection_Venous_Statsis,Were steps taken to prevent prolonged venous stasis?,DCW_911002.doc,enumerated,,,,,,,PhenX,PX911002010200,,,,,Yes,No
PX911002_Factor_Nine_Population_Clotting_Extended_Sample_Collection_Nonhemolyzed,Were nonhemolyzed samples collected?,DCW_911002.doc,enumerated,,,,,,,PhenX,PX911002010300,,,,,Yes,No
PX911002_Factor_Nine_Population_Clotting_Extended_Sample_Collection_Blood_Draw,Was the order of blood draw recorded?,DCW_911002.doc,enumerated,,,,,,,PhenX,PX911002010400,,,,,Yes,No
PX911002_Factor_Nine_Population_Clotting_Extended_Sample_Collection_Tubes,Were collection tubes filled and mixed?,DCW_911002.doc,enumerated,,,,,,,PhenX,PX911002010500,,,,,Yes,No
PX911002_Factor_Nine_Population_Clotting_Extended_Sample_Collection_Venipuncture,Was blood collected by direct venipuncture into 3.2% sodium citrate tubes?,DCW_911002.doc,enumerated,,,,,,,PhenX,PX911002010600,,,,,Yes,No
PX911002_Factor_Nine_Population_Clotting_Extended_Sample_Collection_Tubes_Filled,Were the tubes filled within 11% of the fill line?,DCW_911002.doc,enumerated,,,,,,,PhenX,PX911002010700,,,,,Yes,No
PX911002_Factor_Nine_Population_Clotting_Extended_Sample_Collection_Tubes_Second,Was a second tube collected?,DCW_911002.doc,enumerated,,,,,,,PhenX,PX911002010800,,,,,Yes,No
PX911002_Factor_Nine_Population_Clotting_Extended_Sample_Collection_Tubes_Winged,Was a winged butterfly collection system used?,DCW_911002.doc,enumerated,,,,,,,PhenX,PX911002010900,,,,,Yes,No
PX911002_Factor_Nine_Population_Clotting_Extended_Sample_Collection_Tubes_Discard,Was a discard tube drawn?,DCW_911002.doc,enumerated,,,,,ASK IF Q1.9=YES,,PhenX,PX911002011000,,,,,Yes,No
PX911002_Factor_Nine_Population_Clotting_Extended_Sample_Processing,Were the sample collection and processing procedures outlined in Adcock Funk et al. (2012) followed?,DCW_911002.doc,enumerated,,,,,,,PhenX,PX911002020100,,,,,Yes,No
PX911002_Factor_Nine_Population_Clotting_Extended_Sample_Processing_Sodium_Citrate,Did unprocessed or processed sodium citrate samples remain capped and at room temperature until testing?,DCW_911002.doc,enumerated,,,,,,,PhenX,PX911002020200,,,,,Yes,No
PX911002_Factor_Nine_Population_Clotting_Extended_Sample_Processing_Refrigerated,Were samples refrigerated or stored on ice or in an ice bath?,DCW_911002.doc,enumerated,,,,,,,PhenX,PX911002020300,,,,,Yes,No
PX911002_Factor_Nine_Population_Clotting_Extended_Sample_Processing_Transportation,Were samples transported vertically?,DCW_911002.doc,enumerated,,,,,,,PhenX,PX911002020400,,,,,Yes,No
PX911002_Factor_Nine_Population_Clotting_Extended_Sample_Processing_Agitation,Were samples agitated during transportation?,DCW_911002.doc,enumerated,,,,,,,PhenX,PX911002020500,,,,,Yes,No
PX911002_Factor_Nine_Population_Clotting_Extended_Sample_Processing_Storage_Unprocessed,Were samples stored as unprocessed sodium citrate whole blood samples?,DCW_911002.doc,enumerated,,,,,,,PhenX,PX911002020600,,,,,Yes,No
PX911002_Factor_Nine_Population_Clotting_Extended_Sample_Processing_Storage_Whole_Blood,Were samples stored as whole blood samples centrifuged and maintained in sodium citrate tubes?,DCW_911002.doc,enumerated,,,,,,,PhenX,PX911002020700,,,,,Yes,No
PX911002_Factor_Nine_Population_Clotting_Extended_Sample_Processing_Storage_Plasma,Were samples stored as plasma processed by centrifugation and aliquoting into a second tube?,DCW_911002.doc,enumerated,,,,,,,PhenX,PX911002020800,,,,,Yes,No
PX911002_Factor_Nine_Population_Clotting_Extended_Sample_Processing_Platelet_Poor_Plasma,Were samples processed to platelet poor plasma (PPP) within 1 hour of collection?,DCW_911002.doc,enumerated,,,,,ASK IF Q2.7=YES OR Q2.8=YES,,PhenX,PX911002020900,,,,,Yes,No
PX911002_Factor_Nine_Population_Clotting_Extended_Sample_Processing_Assayed,Were samples assayed within 4 hours of collection?,DCW_911002.doc,enumerated,,,,,ASK IF Q2.7=YES OR Q2.8=YES,,PhenX,PX911002021000,,,,,Yes,No
PX911002_Factor_Nine_Population_Clotting_Extended_Sample_Processing_Centrifuge_Validated,"Was the centrifuge validated so that process results in less than 10,000 platelets/microliter ",DCW_911002.doc,enumerated,,,,,ASK IF Q2.7=YES OR Q2.8=YES,,PhenX,PX911002021100,,,,,Yes,No
PX911002_Factor_Nine_Population_Clotting_Extended_Sample_Processing_Frozen,Was the sample frozen immediately and stored at -20 C for at most 2 weeks?,DCW_911002.doc,enumerated,,,,,ASK IF Q2.7=YES OR Q2.8=YES,,PhenX,PX911002021200,,,,,Yes,No
PX911002_Factor_Nine_Population_Clotting_Extended_Sample_Processing_Deep_Freeze,"Was the sample transferred to <= -70 C, including shipment?",DCW_911002.doc,enumerated,,,,,ASK IF Q2.7=YES OR Q2.8=YES,,PhenX,PX911002021300,,,,,Yes,No
PX911002_Factor_Nine_Population_Clotting_Extended_One_Stage_Clotting_Factor_Assay_Changes,Were any changes made in the protocol over the course of the study?,DCW_911002.doc,enumerated,,,,,,,PhenX,PX911002030100,,,,,Yes,No
PX911002_Factor_Nine_Population_Clotting_Extended_One_Stage_Clotting_Factor_Assay_Record,"Were the make and manufacturer of equipment, repeatability and coefficients of variation for the assay, and the reagents used recorded?",DCW_911002.doc,enumerated,,,,,,,PhenX,PX911002030200,,,,,Yes,No
PX911002_Factor_Nine_Population_Clotting_Extended_Pharmacokinetic_Study,"Were the parameters outlined by the International Society on Thrombosis and Haemostatis Subcommittee on Factor VIII, Factor IX and Rare Coagulation Disorders (Iorio et al., 2917) followed?",DCW_911002.doc,enumerated,,,,,,,PhenX,PX911002040100,,,,,Yes,No
PX911002_Factor_Nine_Population_Clotting_Extended_Pharmacokinetic_Study_After_Infusion_Hours_24,Was a measurement taken 24-36 hours after infusion with a routine dose of the extended half-life product?,DCW_911002.doc,enumerated,,,,,,,PhenX,PX911002040200,,,,,Yes,No
PX911002_Factor_Nine_Population_Clotting_Extended_Pharmacokinetic_Study_After_Infusion_Hours_48,Was a measurement taken 48-60 hours after infusion with a routine dose of the extended half-life product?,DCW_911002.doc,enumerated,,,,,,,PhenX,PX911002040300,,,,,Yes,No
PX911002_Factor_Nine_Population_Clotting_Extended_Pharmacokinetic_Study_After_Infusion_Days,Was a measurement taken 5-14 days after infusion with a routine dose of the extended half-life product?,DCW_911002.doc,enumerated,,,,,,,PhenX,PX911002040400,,,,,Yes,No
PX911002_Factor_Nine_Population_Clotting_Extended_Pharmacokinetic_Model,"Was a ""robust"" population pharmacokinetics model, such as WAPPS-Hemo or PKFit, used?",DCW_911002.doc,enumerated,,,,,,,PhenX,PX911002040500,,,,,Yes,No